{
  "artifacts": [
    {
      "media_type": "application/json",
      "path": "config.json",
      "role": "config",
      "sha256": "4f8508a21a5929280e633d8f1f77f96461daa696451c014b47da55b3690fda03"
    },
    {
      "media_type": "application/json",
      "path": "environment.json",
      "role": "environment",
      "sha256": "e66f74d3b74b2a402bcb903c76b57d960f670fd14a9f61e1406ba4d4305ce39c"
    },
    {
      "media_type": "application/json",
      "path": "metrics.json",
      "role": "table",
      "sha256": "9e805cfa5475c7ccc0f000634fa6c654e4d62231093427739609a5c538168785"
    },
    {
      "media_type": "text/csv",
      "path": "profiles.csv",
      "role": "table",
      "sha256": "3634ddb59121cfaf08a6913e9d8582a4cddf757484fea31e0b2c693595b8a844"
    },
    {
      "media_type": "text/csv",
      "path": "residual_history.csv",
      "role": "residual-history",
      "sha256": "152dbbdfc667a334b941d455a324fb0509bd9aae94b0d2324875f2d6565f6ce4"
    },
    {
      "media_type": "text/plain",
      "path": "stdout.log",
      "role": "log",
      "sha256": "9e805cfa5475c7ccc0f000634fa6c654e4d62231093427739609a5c538168785"
    },
    {
      "media_type": "text/plain",
      "path": "stderr.log",
      "role": "log",
      "sha256": "e3b0c44298fc1c149afbf4c8996fb92427ae41e4649b934ca495991b7852b855"
    }
  ],
  "command": {
    "argv": [
      "/home/user/GeoDiffCFD/jax_cad/.venv/bin/python",
      "examples/29_cavity_re100.py",
      "--config",
      "configs/forward_verification/cavity_re100_cpu_smoke.json",
      "--output-dir",
      "runs/cavity_re100_forward_verification/6d66086/cpu-smoke-16x16"
    ],
    "working_directory": "/home/user/GeoDiffCFD/jax_cad"
  },
  "configuration": {
    "case": "lid-driven-cavity-re100",
    "grid": {
      "lx": 1.0,
      "ly": 1.0,
      "nx": 16,
      "ny": 16
    },
    "mass_flux_mismatch_definition": "closed-boundary normal-flux L1 divided by U_lid*L",
    "physics": {
      "density": 1.0,
      "lid_velocity": 1.0,
      "reynolds_number": 100.0,
      "viscosity": 0.01
    },
    "pressure_gauge": "zero discrete mean",
    "reference": {
      "doi": "10.1016/0021-9991(82)90058-4",
      "name": "Ghia-Ghia-Shin-1982"
    },
    "reference_comparison": {
      "boundary_conditions_exact": true,
      "paper_eligible": true,
      "quantity_definition_exact": true
    },
    "requires_gradient": false,
    "run_id": "cpu-smoke-16x16",
    "schema_version": "forward-verification-config-1.0",
    "solver": {
      "dt": 0.005,
      "include_advection": true,
      "max_steps": 5000,
      "nonlinear_atol": 1e-08,
      "nonlinear_min_steps": 100,
      "nonlinear_rtol": 1e-05,
      "pressure_atol": 1e-12,
      "pressure_maxiter": 1000,
      "pressure_tolerance": 1e-10
    },
    "timing_samples": 3
  },
  "experiment_id": "cavity_re100_forward_verification",
  "git": {
    "branch": "exp/forward-verification-suite",
    "commit": "6d660866277e05e052925afe53d5c1c9f20ab70d",
    "dirty": false,
    "repository": "https://github.com/YupengQI99/jax_cad.git"
  },
  "gradient": {
    "adjoint_residual": null,
    "backend": "none",
    "message": "Canonical forward verification intentionally has no design gradient.",
    "norm": null,
    "parameter_names": [],
    "parameterization": null,
    "success": false,
    "taylor_test": null,
    "values": []
  },
  "hardware": {
    "accelerators": [
      {
        "count": 1,
        "driver": null,
        "memory_bytes": null,
        "name": "cpu",
        "platform": "cpu"
      }
    ],
    "cpu_model": "AMD Ryzen 9 7950X3D 16-Core Processor",
    "hostname": "workstation",
    "logical_cpu_count": 32,
    "memory_bytes": 134155702272,
    "platform": "Linux-6.2.0-39-generic-x86_64-with-glibc2.37"
  },
  "memory": {
    "measurement_method": "resource.getrusage(RUSAGE_SELF).ru_maxrss",
    "peak_accelerator_bytes": null,
    "peak_host_bytes": 610299904
  },
  "notes": "Issue #5 Re=100 cavity; the open-channel pressure outlet is not used.",
  "objective": {
    "name": "ghia_centerline_combined_relative_l2_error",
    "normalization": "published Re=100 Ghia centreline tables",
    "units": "dimensionless",
    "value": 0.10318914139578912
  },
  "primal": {
    "converged": true,
    "divergence_max": 7.301936832959655e-12,
    "divergence_rms": 2.6058867124630895e-12,
    "failure_reason": null,
    "iterations": 2686,
    "mass_flux_mismatch": 0.0,
    "residual_norm": 6.994245882800127e-06
  },
  "run_id": "cpu-smoke-16x16",
  "schema_version": "1.0",
  "software": {
    "backend": "cpu",
    "environment_variables": {
      "JAX_ENABLE_X64": "true",
      "JAX_PLATFORMS": "cpu"
    },
    "jax": "0.7.0",
    "jaxlib": "0.7.0",
    "numpy": "2.3.1",
    "precision": "float64",
    "python": "3.11.13",
    "scipy": "1.16.0"
  },
  "timestamps": {
    "end_utc": "2026-09-01T17:12:07.996927+00:00",
    "exit_code": 0,
    "start_utc": "2026-09-01T17:12:04.929702+00:00",
    "status": "success"
  },
  "timing": {
    "compile_seconds": 0.6019095219671726,
    "forward_samples_seconds": [
      0.2748410531785339,
      0.3082833469379693,
      0.27479194989427924
    ],
    "gradient_samples_seconds": [],
    "optimizer_step_samples_seconds": []
  }
}
